,id,title,num_comments,score,timestamp,url,subreddit
82,ua5g4j,"Sending tanks to Poland 'not a crazy idea', says UK general",12,170,2022-04-23 13:27:59,https://www.bbc.com/news/live/world-europe-61185469?ns_mchannel=social&ns_source=twitter&ns_campaign=bbc_live&ns_linkname=6263a8946b7942142fe9539b%26Sending%20tanks%20to%20Poland%20%27not%20a%20crazy%20idea%27%20-%20UK%20general%262022-04-23T07%3A32%3A32.149Z&ns_fee=0&pinned_post_locator=urn:asset:a027ebc1-3039-4613-b09b-f4d6c1ef8514&pinned_post_asset_id=6263a8946b7942142fe9539b&pinned_post_type=share,UkrainianConflict
83,uahyps,"Mother, daughter and granny. All three killed today in Odesa. Happy Easter, Mr.putin. The Heaven will never accept you.",5,175,2022-04-23 23:48:40,https://twitter.com/IuliiaMendel/status/1517992363683110917?ref_src=twsrc%5Etfw%7Ctwcamp%5Etweetembed%7Ctwterm%5E1517992363683110917%7Ctwgr%5E%7Ctwcon%5Es1_c10&ref_url=https%3A%2F%2Fwww.theguardian.com%2Fworld%2Flive%2F2022%2Fapr%2F23%2Frussia-ukraine-war-latest-zelenskiy-warns-moscow-wants-to-capture-other-countries-as-moldova-expresses-concern-over-russian-plans-live,UkrainianConflict
84,uai1oh,A Sleeping Russian Soldier is Found by Ukrainians Thanks to His Loud Snoring / Location Unknown,28,172,2022-04-23 23:53:18,https://youtube.com/watch?v=_JpfPVlO6oY&feature=share,UkrainianConflict
85,ua68yy,UK gave sanctioned Russians ‘golden visas’ after first Ukraine invasion | The super-rich | The Guardian,13,166,2022-04-23 14:09:24,https://www.theguardian.com/news/2022/apr/22/russians-sanctioned-uk-given-golden-visas-ukraine-invasion,UkrainianConflict
86,ua3gkb,Kharkiv region: Defenders knocked the Russian occupiers out of 3 settlements,5,161,2022-04-23 11:34:11,https://www.pravda.com.ua/eng/news/2022/04/23/7341551/,UkrainianConflict
87,uaf4u9,Turkey bars Russian planes heading for Syria,4,161,2022-04-23 21:20:35,https://ground.news/article/turkey-closes-airspace-to-russian-planes-flying-to-syria_0a2dd7,UkrainianConflict
88,ua79f5,Ukrainians allowed to exchange driving licence for an Irish one The move was welcomed by Ukraine’s ambassador to Ireland.,7,158,2022-04-23 14:59:15,https://www.independent.co.uk/news/uk/irish-people-ukraine-minister-for-transport-b2063637.html,UkrainianConflict
89,uakehz,"Scranton, PA pivotal to US support of Ukraine",32,165,2022-04-24 02:07:13,https://en.m.wikipedia.org/wiki/Scranton_Army_Ammunition_Plant,UkrainianConflict
90,uaj4af,A Russian Armored Column Operating in the Kherson Region Has Been Destroyed by Ukrainian Forces,15,158,2022-04-24 00:53:39,https://youtube.com/watch?v=JQa8RTrs7oc&feature=share,UkrainianConflict
91,uaeyx9,Russia threatens chemical attack on Odesa but is already blaming Ukraine,10,153,2022-04-23 21:12:20,https://www.pravda.com.ua/eng/news/2022/04/23/7341657/,UkrainianConflict
92,uaauvi,HUMILIATION - CHECHEN SOLDIERS ARE KILLING RUSSIAN TROOPS WHO NO LONGER WANTED TO FIGHT || 2022,26,147,2022-04-23 17:50:08,https://www.youtube.com/watch?v=yi_SQGqnanM,UkrainianConflict
93,uahvsy,"Ukraine will ask US for more heavy weapons to defeat Russia, Zelenskiy says",16,148,2022-04-23 23:44:07,https://www.theguardian.com/world/2022/apr/23/ukraine-will-ask-us-for-more-heavy-weapons-to-defeat-russia-zelenskiy-says,UkrainianConflict
94,uagwv3,"Russians are preparing to shell Ukrainian towns this night & tomorrow as Orthodox Christians will celebrate Easter. A Russian soldier tells his woman that they are painting ""Christ is risen"" on the missiles. She laughs – SBU intercepts",18,148,2022-04-23 22:52:37,https://twitter.com/OlenaHalushka/status/1517849417776349186?t=php5QhWogi7C_4NdXGNEdg&s=09,UkrainianConflict
95,ua2rz5,Canada delivers M777 howitzers to Ukraine,21,139,2022-04-23 10:49:57,https://www.ukrinform.net/rubric-ato/3465305-canada-delivers-m777-howitzers-to-ukraine.html,UkrainianConflict
96,ua6ohv,At least 5 dead and 18 wounded in the attack on Odesa. A 3-month-old is among those killed. Ukraine is preparing to celebrate a very dangerous Easter,5,140,2022-04-23 14:30:40,https://twitter.com/IuliiaMendel/status/1517871515039150080?t=juCvbVfdTide6ThsysWL4A&s=19,UkrainianConflict
97,ua8xh8,Russian Families Illegally Adopt Ukrainian Children Forcibly Deported from Occupied Districts – Denisova,13,129,2022-04-23 16:17:30,https://tsn.ua/en/ato/russian-families-illegally-adopt-ukrainian-children-forcibly-deported-from-occupied-districts-denisova-2044480.html,UkrainianConflict
98,ua642h,"Russian breakthrough in Donbas highly unlikely without air dominance — Phillips P. OBrien, Professor of Strategic Studies",14,129,2022-04-23 14:02:39,https://twitter.com/PhillipsPOBrien/status/1517760556542971904?s=20&t=90hk7hVrBaYUL7DpBQmIWg,UkrainianConflict
99,uairid,"One of Russia's largest textbook printers, Prosveshcheniye, has ordered editors to minimize or remove references to Ukraine and Kyiv from schoolbooks on history, literature and geography: ""The task before us is to make it look like Ukraine simply does not exist."" [crosspost from /r/openrussia]",16,140,2022-04-24 00:33:53,https://twitter.com/JuliaDavisNews/status/1517902386169327618,UkrainianConflict
100,uac5mv,German FM Baerbock calls for stronger NATO strategy in Baltics,55,130,2022-04-23 18:52:46,https://youtu.be/W_Q1rU1vsxM,UkrainianConflict
101,uaeepp,"UK: Former ministers have broken ranks to describe how successive prime ministers, including Boris Johnson, withheld arms from Ukraine until just weeks before February’s invasion because of fears they might provoke Vladimir Putin",23,131,2022-04-23 20:44:48,https://www.thetimes.co.uk/article/ukraine-spent-seven-years-begging-three-pms-for-weapons-and-no-one-listened-58t5m9kkq#Echobox=1650733937-1,UkrainianConflict
102,ual9ss,"Putin has ignited a new anti-colonial struggle. This time, Moscow is the target | Nick Cohen",3,141,2022-04-24 02:58:54,https://www.theguardian.com/commentisfree/2022/apr/23/putin-ignited-new-anti-colonial-struggle-this-time-moscow-target,UkrainianConflict
103,uaj230,"As Ukrainian students arrive in Canada, experts urge schools to be welcoming, culturally informed",3,132,2022-04-24 00:50:04,https://www.cbc.ca/news/canada/students-ukraine-refugee-settlement-1.6410177,UkrainianConflict
104,ua7jy5,"“Meanwhile on Russian state TV: hosts and panelists giggling uncontrollably, while discussing nuclear strikes against the continental territory of the United States.",66,122,2022-04-23 15:13:06,https://www.newsweek.com/pentagon-response-russian-tv-nuclear-strike-discussion-1700166,UkrainianConflict
105,uaat2d,"Ukraine president threatens to quit talks if Russia holds ""pseudo-referendums"" in occupied areas",10,123,2022-04-23 17:47:42,https://www.reuters.com/world/europe/ukraine-president-threatens-quit-talks-if-russia-holds-pseudo-referendums-2022-04-23/,UkrainianConflict
106,uag9dc,"Jana Černochová (Czech Minister of Defence): ""... if we have the opportunity to get helicopters of American origin in a shorter time, we will decide where to go with the Mi-24. "" Journalist: ""One place occurs to me - what about Ukraine?"" JC: ""I won't even suggest. But I'm smiling.""",32,126,2022-04-23 22:18:19,https://www.seznamzpravy.cz/clanek/domaci-politika-cernochova-odleta-do-usa-chci-dat-jasny-signal-ze-chceme-patrit-na-zapad-198888,UkrainianConflict
107,ua5j3u,Children of Mariupol who are hiding from Russian bombing. They dream of returning home from the basement of the Azovstal plant. But their city of Mariupol has been completely destroyed by Russian War Criminals.,7,120,2022-04-23 13:32:17,https://twitter.com/VigilantinfoN/status/1517858167522222081,UkrainianConflict
108,uab6of,Vladimir Putin has signaled his tacit approval for further Russian war crimes in Ukraine by publicly honoring one of the military units most closely linked to atrocities against Ukrainian civilians,4,125,2022-04-23 18:05:53,https://english.nv.ua/opinion/putin-just-gave-his-tacit-approval-for-more-war-crimes-50236277.html,UkrainianConflict
109,ua9uz6,Back in the USSR: Lenin statues and Soviet flags reappear in Russian-controlled cities,19,122,2022-04-23 17:01:42,https://www.theguardian.com/world/2022/apr/23/back-in-the-ussr-lenin-statues-and-soviet-flags-reappear-in-russian-controlled-cities?CMP=Share_AndroidApp_Other,UkrainianConflict
110,ua3spn,“Skhid” Task Force killed up to 130 invaders and an aggressors’ warehouse holding ammunition,10,120,2022-04-23 11:55:18,https://www.pravda.com.ua/eng/news/2022/04/23/7341506/,UkrainianConflict
111,ua2bvp,Ukrainian counterattacks slowing Russian offensive in east | AP News,9,119,2022-04-23 10:18:09,https://apnews.com/article/russia-ukraine-kyiv-business-europe-moscow-07659d866eb9496caf00842c3a90f36c,UkrainianConflict
112,uahgzb,Arming Ukraine Is the Path to Peace,9,126,2022-04-23 23:21:56,https://www.thedailybeast.com/arming-ukraine-is-the-path-to-peace?ref=home,UkrainianConflict
113,ua5ng4,Ukrainian counterattacks slowing Russian offensive in east,20,118,2022-04-23 13:38:50,https://ground.news/article/ukrainian-counterattacks-slowing-russian-offensive-in-east_16d09f,UkrainianConflict
114,uam8dz,Russia says it destroyed Odesa terminal where foreign weapons were stored,47,134,2022-04-24 03:57:11,https://ground.news/article/russia-says-it-destroyed-odesa-terminal-where-foreign-weapons-were-stored_de1db4,UkrainianConflict
115,ua3lum,"How the Ukrainian Azov"" regiment helps civilians fleeing Russian shelling in the basements of Azovstal in Mariupol. These children do not yet understand that they are being hunted by murderers & rapists of the Russian Army.",4,113,2022-04-23 11:43:31,https://twitter.com/VigilantinfoN/status/1517828846724296704,UkrainianConflict
116,ua1csa,Former Putin advisor Glaziev promotes a Nazi conspiracy theory: Zelensky sends Ukrainians to die fighting Russia in order to ethnically cleanse the land and repopulate it with Jews,47,113,2022-04-23 09:07:03,https://twitter.com/just_whatever/status/1517778929557417984,UkrainianConflict
117,ualtzm,Russians have started to blue the faces of their servicemen on their media,23,125,2022-04-24 03:32:28,https://twitter.com/HannaLiubakova/status/1517843245509849093,UkrainianConflict
118,uaa7wp,"ISTANBUL, April 23 (Reuters) - Turkish air space has been closed to military and civilian planes carrying troops from Russia to Syria after consultation with Moscow, Turkey's state broadcaster TRT Haber cited Foreign Minister Mevlut Cavusoglu as saying on Saturday.",11,112,2022-04-23 17:19:26,https://twitter.com/idreesali114/status/1517915012144275460,UkrainianConflict
119,uaeff1,Zelensky satisfied with UK military aid,6,109,2022-04-23 20:45:53,https://www.bbc.com/news/live/world-europe-61185469?ns_mchannel=social&ns_source=twitter&ns_campaign=bbc_live&ns_linkname=6264395c6b7942142fe955a9%26Zelensky%20satisfied%20with%20UK%20military%20aid%262022-04-23T18%3A02%3A15.815Z&ns_fee=0&pinned_post_locator=urn:asset:cc74712b-4291-460b-b414-dc3af1b800eb&pinned_post_asset_id=6264395c6b7942142fe955a9&pinned_post_type=share,UkrainianConflict
120,ua260w,Ukraine's President Zelensky rejects Russia's claims to have captured Mariupol - BBC News,2,108,2022-04-23 10:06:40,https://www.youtube.com/watch?v=u0LdIr7SeBw,UkrainianConflict
121,uakdwc,"A Russian Orlan-10 reconnaissance drone was captured by Ukrainian Army forces on the Eastern Front, on April 23rd, 2022. Mostly intact as it either ran out of fuel or had another malfunction, one of many such drones downed by Ukrainian forces in the east.",15,113,2022-04-24 02:06:13,https://twitter.com/uaweapons/status/1517948256071860226?s=21&t=9IzY7dnlso3VjlCtwAvJHA,UkrainianConflict
122,uac6sd,“I want countries in Asia to change their treatment of Ukraine” - Zelenskyy,5,105,2022-04-23 18:54:22,https://www.pravda.com.ua/eng/news/2022/04/23/7341653/,UkrainianConflict
123,uac4ta,Ukraine will exit negotiations if Mariupol residents are killed or Russia conducts “referendums” in occupied territories,0,109,2022-04-23 18:51:40,https://www.pravda.com.ua/eng/news/2022/04/23/7341637/,UkrainianConflict
124,uafs9x,"⚡️ Command of the Air of the Armed Forces of Ukrainereports that by the end of the day on April 23, 17 air targets were hit: 3 aircraft (preliminarily Su-34, Su-35, Su-25), 5 cruise missiles, 9 OTR UAVs (presumably Orlan-10).",16,104,2022-04-23 21:54:10,https://twitter.com/Flash43191300/status/1517984268877766656?s=20&t=Q2kO9ZQh6qYutePu-k7-8w,UkrainianConflict
125,uadrl8,Two more Russian generals killed in Ukraine,6,102,2022-04-23 20:12:11,https://english.nv.ua/nation/two-more-russian-generals-killed-in-ukraine-50236377.html,UkrainianConflict
126,uam797,"Ukrainian forces continue to regenerate captured Russian vehicles, pictured here, a Tigr IMV",9,112,2022-04-24 03:55:15,https://twitter.com/Osinttechnical/status/1518071621684277254,UkrainianConflict
127,uahytm,Two Russian oligarchs and their families found dead within 24 hours,19,102,2022-04-23 23:48:50,https://www.cnn.com/videos/world/2022/04/22/russian-oligarchs-found-dead-within-days-todd-dnt-tsr-vpx.cnn,UkrainianConflict
128,ua5tda,Sailors' families seek answers about Russian ship sinking,22,96,2022-04-23 13:47:31,https://ground.news/article/sailors-families-seek-answers-about-russian-ship-sinking_e7863f,UkrainianConflict
129,uaib6o,A Look Inside the Sprawling Underground Tunnels of the Azovstal Iron & Steel Factory,20,97,2022-04-24 00:08:09,https://youtube.com/watch?v=1GljCXPMhKE&feature=share,UkrainianConflict
130,uafa4e,"""Just give us these weapons, we'll put them to effective use"". Interview of German magazine Spiegel with presidential adviser Oleksiy Arestovich",7,100,2022-04-23 21:28:03,https://www.spiegel.de/ausland/ukraine-berater-von-wolodymyr-selenskyj-im-interview-gebt-uns-einfach-diese-waffen-a-6557da82-afee-42dd-bc37-cb4956535538?d=1650651857&sara_ecid=app_upd_xDl6zCyJhGEY9I3axx5s5LM6z4xunp&sara_ecid=soci_upd_KsBF0AFjflf0DZCxpPYDCQgO1dEMph,UkrainianConflict
131,ua1pe6,Kyiv Awaits NATO Summit Invite As Wider Security Concerns Mount,5,94,2022-04-23 09:33:23,https://www.rferl.org/a/31817482.html,UkrainianConflict
132,uaccd4,"In Mariupol, Putin now rules a wasteland pitted with mass graves | The Guardian",11,97,2022-04-23 19:01:48,https://www.theguardian.com/world/2022/apr/23/in-mariupol-putin-now-rules-a-wasteland-pitted-with-mass-graves,UkrainianConflict
133,ua5t6t,Extended version from the Russian helicopter shooting down 2 days ago reportedly in the direction of Malynivka village. Video shows the helicopter spending approximately 1 & half min launching flares before being downed the moment it stopped launching them.,18,92,2022-04-23 13:47:15,https://twitter.com/Blue_Sauron/status/1517817773199699977?s=20&t=gEGUnGlFE3CIKyDw1flqnA,UkrainianConflict
134,ua1awv,Russia ‘sentences’ Crimean Tatar leader Mustafa Dzhemilev for seeking to enter his native Crimea,5,94,2022-04-23 09:03:18,https://khpg.org/en/1608810455,UkrainianConflict
135,ua9fyv,"Oryx on Twitter: ""Newly added Russian Army equipment losses: 1x Buk-M1-2 (destroyed by TB2) 2x T-80U (destroyed) 1x T-72B3 (destroyed) 1x T-72B3M (destroyed) 1x R-149MA1 command vehicle (destroyed) 1x 120mm 2S9 Nona SPG (destroyed) 2x MT-LB (destroyed) Full list: https://t.co/QR37xcY8mq"" / Twitter",3,96,2022-04-23 16:41:43,https://twitter.com/oryxspioenkop/status/1498311829474496518,UkrainianConflict
136,ua6mvl,Kharkiv regional police had updated that 2 more civilian bodies that were found murdered then burned by the #Putin regime terrorists were found in Husarivka with signs of torture and both were shot “execution style” with a single shot to the head.,0,89,2022-04-23 14:28:30,https://twitter.com/ignis_fatum/status/1517754062762127360?t=ASxEUFP08OWMWGRSfmxKMQ&s=19,UkrainianConflict
137,ua45nn,Extended version from the Russian helicopter shooting down 2 days ago reportedly in the direction of Malynivka village. Video shows the helicopter spending approximately 1 & half min launching flares before being downed the moment it stopped launching them.,28,92,2022-04-23 12:15:47,https://twitter.com/Blue_Sauron/status/1517817773199699977,UkrainianConflict
138,uadum1,"""Yet more equipment from #Russia, captured by the armed forces of #Ukraine"" - so many triggered Russians in the comments on this video lmao",10,92,2022-04-23 20:16:26,https://youtube.com/shorts/RQ_G9rM_kR0?feature=share,UkrainianConflict
139,uaftto,"UK to send more military equipment, Johnson tells Zelensky",3,94,2022-04-23 21:56:20,https://www.bbc.co.uk/news/uk-61203882,UkrainianConflict
140,ua5607,"A veteran pro-Kremlin commentator says Russia's goal in Ukraine is ""the gradual dismantling and phased reformatting of this territory""",16,90,2022-04-23 13:12:50,https://www.bbc.com/news/live/world-europe-61185469?ns_mchannel=social&ns_source=twitter&ns_campaign=bbc_live&ns_linkname=6263ed2fb1e16c43aefe70d9%26Goal%20is%20to%20dismantle%20Ukraine%20-%20Russian%20commentator%262022-04-23T12%3A48%3A52.419Z&ns_fee=0&pinned_post_locator=urn:asset:bca0be4d-89f0-4545-b188-97883a049515&pinned_post_asset_id=6263ed2fb1e16c43aefe70d9&pinned_post_type=share,UkrainianConflict
141,ua1k0a,"""Confessions of a General"" - An interview with Lev Rokhlin 1998 This is an interesting interview about the Chechnya war in 93 and it reveals a lot of similarities with how the Russians are fighting today. Lev was assassinated months after this interview",13,91,2022-04-23 09:22:30,https://youtu.be/IoPB_k0tM_M,UkrainianConflict
142,uaecg5,"Peace talks over if Mariupol defenders killed, says Zelensky",4,90,2022-04-23 20:41:33,https://www.bbc.com/news/live/world-europe-61185469?ns_mchannel=social&ns_source=twitter&ns_campaign=bbc_live&ns_linkname=62643777b1e16c43aefe7253%26Peace%20talks%20over%20if%20Mariupol%20defenders%20killed%20-%20Zelensky%262022-04-23T17%3A37%3A17.302Z&ns_fee=0&pinned_post_locator=urn:asset:c378ae79-efbe-4c50-a780-87807dbcbe6e&pinned_post_asset_id=62643777b1e16c43aefe7253&pinned_post_type=share,UkrainianConflict
143,ua0mge,"After Wimbledon, now Russian and Belarusian players may face Italian Open ban; Ukrainian ace Dolgopolov lauds move",13,83,2022-04-23 08:14:18,https://newsable.asianetnews.com/sports/tennis-rome-masters-after-wimbledon-now-russian-and-belarusian-players-may-face-italian-open-ban-snt-ras94x,UkrainianConflict
144,uacuqi,"Now that Ukraine may get PzH from Netherland, get Germany to deliver these beauties. Looks to be the perfect counter to Russia mass of equipment.",11,90,2022-04-23 19:27:12,https://en.wikipedia.org/wiki/SMArt_155,UkrainianConflict
145,uam0p4,Russia threatens chemical attack on Odesa but is already blaming Ukraine - Russia Vs World,6,94,2022-04-24 03:44:04,https://russiavsworld.org/russia-threatens-chemical-attack-on-odesa-but-is-already-blaming-ukraine/,UkrainianConflict
146,ua48mw,Russia to deploy Sarmat missile by autumn - I edited the title because we all know the plural is a complete lie. They have no industry to build them and not means of supply.,9,79,2022-04-23 12:20:39,https://www.reuters.com/world/europe/russia-deploy-first-nuclear-capable-sarmat-missiles-tass-2022-04-23/,UkrainianConflict
147,uaefsy,Russian Invaders Forcibly Recruit Ukrainian Medics at Gunpoint,13,81,2022-04-23 20:46:26,https://tsn.ua/en/ato/russian-invaders-forcibly-recruit-ukrainian-medics-at-gunpoint-2044510.html,UkrainianConflict
148,uaa77b,"(Reuters) - Russia resumed its assault on the last Ukrainian defenders holed up in a giant steel works in Mariupol, a Ukrainian official said on Saturday, days after Moscow declared victory in the southern port city and said its forces did not need to take the plant.",11,85,2022-04-23 17:18:27,https://twitter.com/phildstewart/status/1517884238611238912,UkrainianConflict
149,uae1b4,"Kharkiv, Viktor Hubariev, 79, killed by Russian bomb. He went out to buy bread and bring it back home to his daughter Iana. His daughter still has that bread with her father's blood on it. ""It is a part of my father"", she says.",2,79,2022-04-23 20:25:52,https://twitter.com/EmineDzheppar/status/1517916919344599040?t=vPvRhhowTYalX42sk-0-GQ&s=19,UkrainianConflict
