,id,title,num_comments,score,timestamp,url,subreddit
0,ua3d9g,"@Mykhailova_A First picture was taken in 2014,we’re driving to Debaltsevo. I’m 19. Second photo is from 2022,we’re driving in the same area,but to the different destination.I’m 27. 8 years of war. We’re at the same place. Doing the same thing. Destroying occupiers as good as we can.",310,10759,2022-04-23 11:28:21,https://www.reddit.com/gallery/ua3d9g,UkrainianConflict
1,uaavym,"In Kharkiv, Ukrainian SBU officers detained a Russian agent, she determined locations of military infrastructure, Ukrainian military locations, also gave locations of schools, hospitals, stores/markets to Russian forces. During the search - a laptop, phones, computer and Russian rubles were found.",511,3926,2022-04-23 17:51:38,https://www.reddit.com/r/SlavaUkrayini/comments/ua3gcg/in_kharkiv_sbu_officers_detained_an_agent_of/?utm_source=share&utm_medium=ios_app&utm_name=iossmf,UkrainianConflict
2,uadlll,"In Russia a customer left a bad review for online shop after he ordered a T-shirt with the ""Z"" symbol, but it arrived with the word ""Moron"" written on the package by an employee",62,2520,2022-04-23 20:03:45,https://www.reddit.com/gallery/uadlll,UkrainianConflict
3,ua7dyl,Ukrainian GUR confirms 2 Russian generals dead and one heavily wounded in yesterday's attack near Kherson,244,2117,2022-04-23 15:04:52,https://t.me/DIUkraine/396,UkrainianConflict
4,uahbew,Polish Prime Minister met with his Ukrainian counterpart today. They signed a deal that will help Ukraine send its exports through Polish ports since Russia’s blockade has cut them off from the Black Sea. Grain will head for Africa & the Middle East through Poland,99,2307,2022-04-23 23:13:37,https://twitter.com/visegrad24/status/1517998176237727746,UkrainianConflict
5,ua97rv,BREAKING — Turkey has closed its airspace to Russian civilian and military aircraft that transports soldiers to Syria after notifying Moscow: Turkish Foreign Minister via TRT,106,1986,2022-04-23 16:31:03,https://twitter.com/ragipsoylu/status/1517900793327857667,UkrainianConflict
6,uagkrb,"Customs duties: Russia paid them in rubles but Kazakhstan rejected the payment and now Kazakh tycoons and citizens are asking Tokayev to hold a referendum on leaving the EaEu and CSTO, Kazakh politicians are also asking Tokayev to prepare the ground for a gradual withdrawal from the two alliances",147,1950,2022-04-23 22:34:57,"https://www.repubblica.it/esteri/2022/04/22/news/russia_rivolta_paesi_satelliti_exurss-346503686/#:~:text=MOSCA%20%2D%20L'offensiva%20in%20Ucraina,grande%20influenza%20politica%20ed%20economica.",UkrainianConflict
7,ua5kup,A subsidiary of the German defense concern Rheinmetall appealed to the federal government in Berlin for permission to supply Kyiv with 100 Marder infantry fighting vehicles.,139,1590,2022-04-23 13:34:56,https://www.eurointegration.com.ua/news/2022/04/23/7138289/,UkrainianConflict
8,uaiaxs,"Picture of Valeria and her three months old baby Kira, killed on the 23rd of April in the Russian missile attack against Odesa. Pictures were taken and posted by Valeria’s husband. This is what Russia wants for Eastern Europe.",83,1388,2022-04-24 00:07:44,https://twitter.com/myroslavapetsa/status/1517990210017050627,UkrainianConflict
9,uac73h,Scholz’s lies and manipulations to avoid sending weapons to Ukraine (w/ sources),288,1251,2022-04-23 18:54:48,https://medium.com/@marksavchuk/scholzs-lies-and-manipulations-to-avoid-sending-weapons-to-ukraine-8dcef509aa21,UkrainianConflict
10,uabtsf,Russia’s Military Is Getting Defeated by Ukrainian Mud,108,1177,2022-04-23 18:36:29,https://futurism.com/the-byte/russia-ukraine-mud,UkrainianConflict
11,ua0i18,"A video from 1997 showing the autoload capabilities of the German PZH2000 155mm howitzer. Netherlands 🇳🇱 will supply this beast to Ukraine 🇺🇦. I did not think NL would be sending their best artillery, but here we are. Thanks Mark!",197,974,2022-04-23 08:05:40,https://youtu.be/Tc9sb71px5I,UkrainianConflict
12,ua6xqd,"""The only aim of Russian missile strikes on Odesa is terror. Russia must be designated a state sponsor of terrorism and treated accordingly"", says Ukrainian government",21,969,2022-04-23 14:43:11,https://twitter.com/DmytroKuleba/status/1517850557926580224,UkrainianConflict
13,uadfwq,"Russian soldier: ""We're tired here. There's a sniper next to us who is removing everyone. Today he got 4 people""",162,968,2022-04-23 19:56:13,https://www.youtube.com/watch?v=SeI2bciDJ5g,UkrainianConflict
14,uae5p6,Estonia (population 1.3 million) is the world’s 2nd largest provider of military aid to Ukraine - but that doesn’t include the huge support from individuals & companies here too. Here’s yet another privately funded convoy leaving from Tallinn,36,945,2022-04-23 20:31:55,https://twitter.com/adamrangpr/status/1517956648580653057,UkrainianConflict
15,uagaci,"Ukrainian Army forces of the Azov Battalion/Regiment still holding and resisting against the Russian Army, in the Illich Steel and Iron Works factory complex in besieged and destroyed Mariupol. They are equipped with British NLAWs and mainly Kalashnikov assault rifles, recent photos, April 2022.",198,959,2022-04-23 22:19:48,https://twitter.com/ukrpravda_news/status/1517763270094041089?s=21&t=n28RuyL9vF2liMrwPideNg,UkrainianConflict
16,uacmpf,The new “Defense of the Homeland-law” came into force in Poland today. It will increase the Polish Army from 150 000 to 300 000 over the next years & introduce more modern equipment. It will also increase military spending from slightly over 2% of GDP to 3% by 2023.,63,897,2022-04-23 19:16:01,https://twitter.com/visegrad24/status/1517904162775879683,UkrainianConflict
17,ua5g1e,The Polish PM has just revealed that Poland has sent Ukraine 7 bilion złoty (1.6 billion euros) worth of weapons.,47,794,2022-04-23 13:27:50,https://twitter.com/visegrad24/status/1517855575060664323,UkrainianConflict
18,ua9j3p,"Tver region in Russia bought 100 000 ""patriotic"" stickers for 3.8 million rubles and hung them around the city. A month later, looks like corruption took place in this “state procurement” - the stickers turned out to be of such poor quality that they lost their colour and turned into Ukraine flags.",43,736,2022-04-23 16:46:02,https://t.me/dvachannel/90334,UkrainianConflict
19,ua8yr0,Ukraine says two more Russian generals killed,45,665,2022-04-23 16:19:11,https://www.bbc.com/news/live/world-europe-61185469?ns_mchannel=social&ns_source=twitter&ns_campaign=bbc_live&ns_linkname=626414d1b1e16c43aefe71b4%26Ukraine%20says%20two%20more%20Russian%20generals%20killed%262022-04-23T15%3A44%3A02.037Z&ns_fee=0&pinned_post_locator=urn:asset:3d609710-b1cb-4c28-acd8-279f3ac1abe0&pinned_post_asset_id=626414d1b1e16c43aefe71b4&pinned_post_type=share,UkrainianConflict
20,ua287a,"If we do not start arming Moldova now, have we really learnt anything at all in the past two months? - Visegrad24",112,640,2022-04-23 10:11:04,https://mobile.twitter.com/visegrad24/status/1517682529326837761,UkrainianConflict
21,ua7u0z,"Russia Blocks Economic Data, Hiding Effect of Western Sanctions",60,618,2022-04-23 15:26:40,https://www.wsj.com/articles/russia-blocks-economic-data-hiding-effect-of-western-sanctions-11650677765,UkrainianConflict
22,uafk76,"Combines stolen by ""Kadyrovites"" from Melitopol that they will not be able to use. The manufacturer tracked the location of stolen agricultural machinery thanks to GPS and turned them off remotely.",62,628,2022-04-23 21:42:11,https://twitter.com/TpyxaNews/status/1517981860860674048?t=RVx8b_xjmdA-fvcZjejw7g&s=19,UkrainianConflict
23,ua0xzw,"G20 cannot function with Russia at the table, Canada says",32,594,2022-04-23 08:37:15,https://www.reuters.com/world/canada-says-g20-cannot-function-with-russia-table-2022-04-22/,UkrainianConflict
24,uac8eg,Zelenskyy: We will return our territories as soon as we have weapons,35,572,2022-04-23 18:56:36,https://www.pravda.com.ua/eng/news/2022/04/23/7341645/,UkrainianConflict
25,uabbyi,"308 residents of #Mariupol, incl 90 kids, were kidnapped and forcibly moved to Vladivostok, the town in Russia's far east. It is ~9,500km from Mariupol.",34,565,2022-04-23 18:12:55,https://twitter.com/OlenaHalushka/status/1517822391279394816,UkrainianConflict
26,ua35vo,"Flash on Twitter: A fake video of Volodymyr Zelenskyi with a white powder substance on his table is getting viral within the Russian media. They are using footage from March 6th. However, the white powder substance is missing from the original footage.",85,513,2022-04-23 11:15:39,https://twitter.com/flash43191300/status/1517618967061409792?s=21&t=Q6OJaBKkrzu_Uc-tFrNCSgmm,UkrainianConflict
27,ua2h9o,"""Criticism when a Russian ship unloads in Sweden"" as much as 90 % of the Russian ships are allowed to do business as usual in EU countries because of exceptions in sanctions.",35,503,2022-04-23 10:28:59,https://www.svd.se/a/x8kq8l/kritik-nar-ryskt-fartyg-lossar-i-sverige,UkrainianConflict
28,uag44j,Nunavut senator calls being banned from Russia a 'badge of honour',17,532,2022-04-23 22:10:36,https://www.cbc.ca/news/canada/north/patterson-banned-russia-1.6428306,UkrainianConflict
29,ua4mt3,"The Armed Forces of Ukraine carried out a successful counteroffensive north of Kharkiv, liberating the settlements of Bezruky, Slatyne and Prudyanka from the Russian fascist invaders.",36,508,2022-04-23 12:43:44,https://twitter.com/mhmck/status/1517801765063774211,UkrainianConflict
30,uahq6i,"Without making it public, Slovakia has started transferring T-72 tanks to Ukraine. Two of them were spotted today in the Luhansk region, heading for the frontlines.",41,510,2022-04-23 23:35:29,https://twitter.com/visegrad24/status/1518010043311996928,UkrainianConflict
31,uaajy6,"Maria Antonova on Twitter: Plans to reinstate Soviet-era 'first departments' in state companies: special staff will spy on employees and report disloyalty to Putin, as well as organize mandatory pro-army rallies and place propaganda posters in the workplace (yes, POSTERS).",105,463,2022-04-23 17:35:38,https://twitter.com/mashant/status/1517903362959753217,UkrainianConflict
32,uad2tp,Up to 150 invaders eliminated in eastern Ukraine today,29,445,2022-04-23 19:38:32,https://www.ukrinform.net/rubric-ato/3465727-up-to-150-invaders-eliminated-in-eastern-ukraine-today.html,UkrainianConflict
33,ua13tm,"Russian Ministry of Defense states that the US is preparing provocation to accuse Russia of using chemical, biological or tactical nuclear weapons in Ukraine. They state that these plans have already been developed and are a reaction to the success of the Russian army in Ukraine. God help us all...",183,429,2022-04-23 08:49:10,https://t.me/ru2ch_news/42136,UkrainianConflict
34,uae7rz,"According to preliminary information, on Saturday, April 23, the Russians lost a multi-role fighter and fighter-bomber in Kharkiv region.",12,424,2022-04-23 20:34:51,https://nv.ua/ukr/kharkiv/boji-v-harkivskiy-oblasti-zsu-zbili-2-litaki-ta-4-bpla-novini-harkova-ta-oblasti-50236402.html,UkrainianConflict
35,uaab9c,"Ukraine Army destroys enemy command operations center, eliminates two Russian generals",29,409,2022-04-23 17:23:56,https://www.ukrinform.net/rubric-polytics/3465606-ukraine-army-destroys-enemy-command-operations-center-eliminates-two-russian-generals.html,UkrainianConflict
36,ua2uqu,Chechen 'Kadyrovite' Headquarters and Vehicles in Mariupol Hit by Ukrainian Artillery Strike,25,398,2022-04-23 10:55:29,https://youtube.com/watch?v=im3a7OKu76o&feature=share,UkrainianConflict
37,uaggw3,Ohio Army National Guard to send armored vehicles to Ukraine,40,406,2022-04-23 22:29:32,https://ground.news/article/state-national-guards-to-send-armored-vehicles-to-ukraine_72684f,UkrainianConflict
38,ua9ky3,Ukrainian paratroopers congratulated Her Majesty Queen Elizabeth II on her birthday,45,390,2022-04-23 16:48:33,https://www.ukrinform.net/rubric-ato/3465656-ukrainian-paratroopers-congratulated-her-majesty-queen-elizabeth-ii-on-her-birthday.html,UkrainianConflict
39,uafwb7,Article: Russian troops came to kidnap and murder Mokrets village Mayor. She survived by being protected by her villagers. Every day bravery.,5,388,2022-04-23 21:59:55,https://amp.abc.net.au/article/101000692,UkrainianConflict
40,ua9gtd,"Russia has already lost 21.6 thousand servicemen, 854 tanks and 2205 armored vehicles in Ukraine",32,369,2022-04-23 16:42:54,https://interfax.com.ua/news/general/826563.html,UkrainianConflict
41,uagmxv,"Ukrainian air defense units destroy 17 air targets over past day including three aircraft (preliminarily Su-34, Su-35 and Su-25).",35,389,2022-04-23 22:38:11,https://www.ukrinform.net/rubric-ato/3465841-ukrainian-air-defense-units-destroy-17-air-targets-over-past-day.html,UkrainianConflict
42,uai7mf,"EU urges citizens to work from home, drive slower to reduce reliance on Russia",17,382,2022-04-24 00:02:23,https://ground.news/article/eu-urges-citizens-to-work-from-home-drive-slower-to-reduce-reliance-on-russia_518670,UkrainianConflict
43,ua6j6t,Freedom of Russia Legion (formed by defected Russian soldiers as part of Ukrainian TDF) have released new photos. Combatants appear to be using two modified AKS-74 rifles with Strela flash hiders and a UK-supplied NLAW ATGM (MBT LAW),16,334,2022-04-23 14:23:29,https://twitter.com/war_noir/status/1517852125623169026?t=A9nPFFmy2VuMNKaaVUHz3Q&s=19,UkrainianConflict
44,ua3jde,"""Our task is to make it appear as if Ukraine simply does not exist."" References to Kiyv and Ukraine are being removed from the textbooks of Russia's main publishing house",36,338,2022-04-23 11:39:13,https://zona.media/article/2022/04/23/enlightenment,UkrainianConflict
45,ua5d8z,Russia must be designated a state sponsor of terrorism - Minister of Foreign Affairs Dmytro Kuleba on the shelling of Odesa.,3,324,2022-04-23 13:23:44,https://t.me/ukrainenowenglish/5911,UkrainianConflict
46,uabob5,"Ukraine Army destroys enemy command operations center, eliminates two Russian generals",25,316,2022-04-23 18:29:29,https://www.ukrinform.net/rubric-ato/3465606-ukraine-army-destroys-enemy-command-operations-center-eliminates-two-russian-generals.html,UkrainianConflict
47,uahsj7,"Russia is trying to take mediocre platoons & pit them at really good squads & finding themselves outmaneuvered by a smaller but far more agile & task organized force. When Russia can actually fix Ukraine in force on force fights, Russia wins. So Ukraine simply refuses that fight.",56,324,2022-04-23 23:39:03,https://threadreaderapp.com/thread/1517986802379993090.html,UkrainianConflict
48,uaevrx,"Yesterday, April 23, Russia killed Valeriia Hlodan from Odesa and her three-month-old daughter Kira. Freaks who call themselves orthodox christians kill women and children few hours before Easter.",15,301,2022-04-23 21:08:04,https://twitter.com/BackAndAlive/status/1517972903106600960?t=RLCfe7tL9RGcc3wOLgQQbg&s=19,UkrainianConflict
49,uadlag,"The Ukrainian Ministry of Defense is reporting that Russian Forces are preparing for a Large-Scale Assault in the next 24 hours, involving Armor and Air Assets, on the City of Severodonetsk in the Eastern part of the Country, Ukrainian Forces are being reinforced accordingly.",28,295,2022-04-23 20:03:19,https://twitter.com/sentdefender/status/1517929245141397504?t=xF8X_Z03TsuW51OYX2r-og&s=19,UkrainianConflict
50,ua9u4q,Foreign Affairs Committee Chairs of🇵🇱🇱🇹🇱🇻🇪🇪🇺🇦are calling to provide all necessary heavy weapons to Ukraine in a joint statement: 🔹Russia can be stopped only by military defeat 🔹Restoration of Ukraine’s internationally recognized borders is the only way to prevent next🇷🇺attacks,4,287,2022-04-23 17:00:35,https://twitter.com/euromaidanpress/status/1517908403435282436?s=21&t=aDmJCWWIfDPZkPrALQAiKw,UkrainianConflict
51,ua4u9v,Russian State TV Host Shows Plan on How Russian Forces Can Seize The Baltic States From Europe,219,283,2022-04-23 12:55:50,https://youtube.com/watch?v=8uSd9RYQH0I&feature=share,UkrainianConflict
52,uaf018,Zelenskyy: The word “Ruscism” will enter history textbooks all over the world,17,285,2022-04-23 21:13:54,https://www.pravda.com.ua/eng/news/2022/04/23/7341654/,UkrainianConflict
53,uad9bk,President: Ukraine will start to retake occupied territories as soon as we receive enough weapons,14,279,2022-04-23 19:47:27,https://www.ukrinform.net/rubric-ato/3465763-president-ukraine-will-start-to-retake-occupied-territories-as-soon-as-we-receive-enough-weapons.html,UkrainianConflict
54,uakbny,"Ukrainian Valeria, her baby daughter Kira was just three months old, and Valeria's mother were killed when a Russian missile hit their residential building in the port city of Odessa, southwest Ukraine, April 23rd, 2022. They were among eight Ukrainians killed by Russian strikes on that city.",16,302,2022-04-24 02:02:45,https://twitter.com/strategywoman/status/1517961167016239105?s=21&t=9IzY7dnlso3VjlCtwAvJHA,UkrainianConflict
55,uadsre,More than 20 countries have agreed to take part in the US-hosted discussion of Ukraine's defense needs in Rammstein next week - the Pentagon,22,262,2022-04-23 20:13:49,https://censor.net/ua/news/3336183/uje_ponad_20_krayin_pogodylysya_vzyaty_uchast_v_obgovorenni_oboronnyh_potreb_ukrayiny_pentagon,UkrainianConflict
56,uafja3,"April 23, 2022: UA Air Force destroyed 3 Russian planes (preliminarily Su-34, Su-35, Su-25), 5 cruise missiles, and 9 UAVs",18,254,2022-04-23 21:40:53,https://www.facebook.com/kpszsu/videos/954045168595654/,UkrainianConflict
57,uaa7zq,"President Zelensky says Ukraine will suspend negotiations with Russia if a ""referendum"" on the creation of a separatist republic in Kherson is held",7,242,2022-04-23 17:19:31,https://twitter.com/michaelh992/status/1517910550700826625?t=GJLZOvrqlckLNfJDmBiNOg&s=09,UkrainianConflict
58,ua7jor,"Discussion: Train derailment as warfare. It doesn't seem hard to cast something like this device and smuggle it around Russia or Crimea. Paint them black and have at it. Crimea is a vital rail shipping path for Russia and it is very thin, very long, difficult to defend, and has many overpasses.",65,240,2022-04-23 15:12:43,https://nolancompany.com/portable-derails/,UkrainianConflict
59,ua9v3m,"Orcs disguised mines in children's toys, books. The occupiers were well aware that the child would pick up the toy at the first place when back at home.",15,242,2022-04-23 17:01:52,https://socportal.info/en/news/okkupanty-pryachut-miny-v-detskie-igrushki/,UkrainianConflict
60,uamvug,Russian offensive near Oleksandrivka failed. Ukraine liberated 8 settlements in Kherson Oblast. Russian equipment staging area hit near Posad.,13,318,2022-04-24 04:38:40,https://m.facebook.com/story.php?story_fbid=2039927556178487&id=528312067340051,UkrainianConflict
61,ua99si,"Two Mariupol girl actresses killed. They had both played Lucy, a character in The Lion, the Witch and the Wardrobe in The Chronicles of Narnia.",3,238,2022-04-23 16:33:48,https://www.bbc.com/news/live/world-europe-61185469?ns_mchannel=social&ns_source=twitter&ns_campaign=bbc_live&ns_linkname=62641ea9b1e16c43aefe71f8%26Two%20little%20Mariupol%20actresses%20killed%20-%20Ukraine%20official%262022-04-23T16%3A05%3A56.935Z&ns_fee=0&pinned_post_locator=urn:asset:852c9352-74bc-4dd6-8dd8-e8fa6e178621&pinned_post_asset_id=62641ea9b1e16c43aefe71f8&pinned_post_type=share,UkrainianConflict
62,uajxnj,"Poland has provided Ukraine with weapons worth around 7 billion PLN - announced Prime Minister @MorawieckiM during the conference for the initiative #StopRussiaNOW. This is over 1.6 billion dollars to defend Ukrainian, Polish and European sovereignty!",23,263,2022-04-24 01:40:00,https://twitter.com/PiotrMuller/status/1517862593834192898,UkrainianConflict
63,uaf8e5,"#Russia wants to organize a parade of #Ukrainian prisoners on May 9, — Adviser to the Head of the President's Office of #Ukraine, Oleksii Arestovych. «This is a severe violation of the Geneva Conventions and all the rules of war!» – he says.",66,252,2022-04-23 21:25:35,https://twitter.com/EuromaidanPR/status/1517977763508101122?t=7V92apQOkpzVsfyne7Bc2Q&s=19,UkrainianConflict
64,ua3i7w,"UK: Stormer Anti-Aircraft Missile Trucks Head to Ukraine, Reports Say",2,235,2022-04-23 11:37:11,https://www.businessinsider.com/uk-stormer-anti-aircraft-missile-trucks-head-to-ukraine-reports-say-2022-4?IR=T,UkrainianConflict
65,uae0n0,Russian general says Moscow aim is to leave Ukraine as a landlocked country,39,241,2022-04-23 20:24:56,https://www.euractiv.com/section/global-europe/news/russian-general-says-moscow-aim-is-to-leave-ukraine-as-a-landlocked-country/,UkrainianConflict
66,uagt6d,"In Tula, a young mother tore the letters Z off the window of a kindergarten. She was fined 48,000 rubles for discrediting the actions of the RF Armed Forces.",24,222,2022-04-23 22:47:15,https://mobile.twitter.com/vottak_tv/status/1517800357371523072,UkrainianConflict
67,ua7j1c,"On April 22nd, Ukrainian defenders destroyed a forward command post of Russia's 49th Combined Arms Army in temporarily-occupied Kherson region. Stupidly, the invaders located the post close to the battlefront. Two Russian generals were killed. Another was seriously wounded.",12,199,2022-04-23 15:11:49,https://twitter.com/mhmck/status/1517878146095321088?s=20&t=-RhzxMH40mSIEXB0LbK7YA,UkrainianConflict
68,uaeadp,"Pundit argues on Russian state TV that the exits at Azovstal should be sealed off with concrete. Host prefers the idea of capturing Ukrainians and showing them at public markets, allowing anyone to do ""whatever they want"" to them",55,202,2022-04-23 20:38:33,https://twitter.com/JuliaDavisNews/status/1517958546712928259?t=OZrobosgnxOTg50w83nCiA&s=09,UkrainianConflict
69,uabfnm,Zelenskiy’s economic guru: ‘Germany can survive without Russian oil: I wouldn’t want my country facing the shame’ | The Guardian,43,198,2022-04-23 18:17:52,https://www.theguardian.com/business/2022/apr/23/zelenskiys-economic-guru-germany-can-survive-without-russian-oil,UkrainianConflict
70,uai5a5,"Now That An F-15 Sale Is On The Cards, Will Egypt Give Ukraine Its MiG-29s?",36,205,2022-04-23 23:59:09,https://www.forbes.com/sites/pauliddon/2022/04/22/now-that-an-f-15-sale-is-on-the-cards-will-egypt-give-ukraine-its-mig-29s/?sh=5bed18fb3f7a,UkrainianConflict
71,ua1eht,A gift from the Armed Forces of Ukraine has arrived at the Kadyrov pig base. TikTok soldiers are running away.,18,196,2022-04-23 09:10:37,https://twitter.com/VigilantinfoN/status/1517785213660811266,UkrainianConflict
72,ualf81,Countries buying Russian oil ‘complicit in war crimes’ says Ukraine adviser | Ukraine,22,220,2022-04-24 03:07:30,https://www.theguardian.com/world/2022/apr/23/countries-buying-russian-oil-complicit-in-war-crimes-says-ukraine-adviser,UkrainianConflict
73,uajvu7,Russia’s Tchaikovsky Competition expelled from the World Federation of International Music Competitions,12,217,2022-04-24 01:36:56,https://www.classicfm.com/composers/tchaikovsky/russian-music-competition-expelled-world-federation/,UkrainianConflict
74,ua2np4,"Mayor of Mariupol: Another large grave has been found, the worst genocide since the Holocaust - Russia Vs World",18,189,2022-04-23 10:41:19,https://russiavsworld.org/mayor-of-mariupol-another-large-grave-has-been-found-the-worst-genocide-since-the-holocaust/,UkrainianConflict
75,uan4vi,Ukraine regains control of eight settlements in Kherson region,8,238,2022-04-24 04:55:03,https://www.ukrinform.net/rubric-ato/3465926-ukraine-regains-control-of-eight-settlements-in-kherson-region.html,UkrainianConflict
76,uajald,A kind of Russian war analytics. Far-right former colonel Kvachkov explains to international war criminal Igor Girkin what he believes is the main problem of Russian army - too many jews,48,195,2022-04-24 01:03:11,https://twitter.com/kmartynov/status/1518015183473590276?t=qNWV3piLIt2Tp_Ia8Qlhiw&s=19,UkrainianConflict
77,ua77jg,Amazon has donated over $35 million to help Ukrainian refugees.,40,173,2022-04-23 14:56:39,https://espreso.tv/amazon-skeruvav-ponad-35-mln-na-dopomogu-ukrainskim-bizhentsyam,UkrainianConflict
78,uaito0,Southern Axis Update: #Russian forces paused ground offensive operations in northern #Kherson Oblast. The Ukrainian Resistance Center reported that an organized resistance movement has killed 100 Russian occupation personnel since the start of the war. [crosspost from /r/openrussia],14,189,2022-04-24 00:37:09,https://twitter.com/TheStudyofWar/status/1518008394245828608,UkrainianConflict
79,ua6gcx,Russia says British SAS 'sabotage specialists' in Ukraine,85,166,2022-04-23 14:19:49,https://www.bbc.co.uk/news/live/world-europe-61185469?ns_mchannel=social&ns_source=twitter&ns_campaign=bbc_live&ns_linkname=626349e2b1e16c43aefe7031%26Russia%20says%20British%20SAS%20%27sabotage%20specialists%27%20in%20Ukraine%262022-04-23T00%3A53%3A13.302Z&ns_fee=0&pinned_post_locator=urn:asset:771a810f-fcd3-41da-b855-971f4c875ee5&pinned_post_asset_id=626349e2b1e16c43aefe7031&pinned_post_type=share,UkrainianConflict
80,uaeulp,UK warns Russia not to enlist civilians in military,39,169,2022-04-23 21:06:26,https://www.bbc.com/news/live/world-europe-61185469?ns_mchannel=social&ns_source=twitter&ns_campaign=bbc_live&ns_linkname=62645de4b1e16c43aefe72a4%26UK%20warns%20Russia%20not%20to%20enlist%20civilians%20in%20military%262022-04-23T20%3A21%3A57.894Z&ns_fee=0&pinned_post_locator=urn:asset:b1c3fb4c-47db-406d-ba2f-348d4bda43e3&pinned_post_asset_id=62645de4b1e16c43aefe72a4&pinned_post_type=share,UkrainianConflict
81,ua1myl,National Guard of Ukraine has a new fighter with the call sign MAX. This is a Belgian shepherd dog that was adopted by Ukrainian soldiers in the Mykolaiv region. Previously its owners were Russian soldiers - the Putin's invaders abandoned it when they were retreating.,9,167,2022-04-23 09:28:46,https://twitter.com/VigilantinfoN/status/1517792901220245506,UkrainianConflict
